{"schema":"dotpkg.plan","version":1,"manifest":"packages.yaml","profile":"server","changes":2,"stages":[{"name":"packages","declared":[],"adopted":[],"missing":["git"],"extra":[],"changes":[{"action":"install","item":"git"}]},{"name":"groups","declared":[],"adopted":[],"missing":[],"extra":[],"changes":[]},{"name":"configs","declared":[],"adopted":[],"missing":[],"extra":["config/old:$HOME/.old"],"changes":[{"action":"remove","item":"config/old:$HOME/.old"}]},{"name":"services","declared":[],"adopted":[],"missing":[],"extra":[],"changes":[]}]}
